{
  "session_id": "work-notify",
  "kind": "work",
  "class": "work",
  "created_by": {
    "principal": "app:app2@alice",
    "via": "app"
  },
  "driver": {
    "principal": "app:app2@alice"
  },
  "location": "${FIXTURE_ROOT}/app/work-notify",
  "wake_event": "/opendan/jarvis.alice/session/work-notify/input",
  "agent_access": "full",
  "objective": "Pick the database of the notes app",
  "status": {
    "rev": 3,
    "run_state": "waiting",
    "acceptance": "n/a",
    "one_line_status": "",
    "report_brief": "",
    "waiting_for": "input",
    "turn_open": true,
    "activity": {
      "summary": "Pick the database of the notes app",
      "heartbeat_ms": 1792254516426
    },
    "last_runner": {
      "runner_id": "rn-7ce57bb987964187",
      "host": "${FIXTURE_HOST}",
      "pid": 3519233,
      "lock_epoch": 1,
      "at_ms": 1792254516481
    },
    "updated_at_ms": 1792254516479
  },
  "location_rev": 0
}